{
  "$schema": "../../family.schema.json",
  "family": "thumbnail",
  "name": "Thumbnail",
  "description": "Image-bearing rectangle that surfaces alongside list rows, feed items, and channel headers. Single-spec family.",
  "useCases": [
    "avatar",
    "channel image",
    "list leading image",
    "feed thumbnail",
    "circular image"
  ],
  "spec": "thumbnail.md",
  "subcomponents": [
    {
      "slug": "thumbnail",
      "spec": "thumbnail.spec.json",
      "md": "thumbnail.md",
      "default": true
    }
  ]
}
