{
  "$schema": "../../family.schema.json",
  "family": "navigation-bar",
  "name": "NavigationBar",
  "description": "Top-bar family. `home` is the landing-screen bar (left-aligned title + trailing action icons); `page` is the drill-in bar (centred title + leading back / trailing action); `search` is the search-page bar (leading back + bare-text input filling the row + conditional clear). All three ride the same 56px min-height and 8/8 padding so they stay at one geometry across a navigation flow.",
  "useCases": [
    "screen header",
    "landing-screen top bar",
    "drill-in top bar",
    "search top bar",
    "back navigation"
  ],
  "spec": "navigation-bar.md",
  "subcomponents": [
    {
      "slug": "home",
      "spec": "home.spec.json",
      "md": "home.md",
      "default": true
    },
    {
      "slug": "page",
      "spec": "page.spec.json",
      "md": "page.md"
    },
    {
      "slug": "search",
      "spec": "search.spec.json",
      "md": "search.md"
    }
  ]
}
