{
  "$schema": "../../family.schema.json",
  "family": "toast",
  "name": "Toast",
  "description": "Transient confirmation strip — a short status message anchored to the viewport edge, surfaced after a user action lands (saved, copied, sent). Inverse-toned by default so the message contrasts with any underlying page tier without per-surface tuning. Single-spec family.",
  "useCases": [
    "transient confirmation",
    "post-action status",
    "undo affordance",
    "non-blocking notice"
  ],
  "visualReuse": "locked",
  "spec": "toast.md",
  "subcomponents": [
    {
      "slug": "toast",
      "spec": "toast.spec.json",
      "md": "toast.md",
      "default": true
    }
  ]
}
