{
  "$schema": "../../family.schema.json",
  "family": "chip",
  "name": "Chip",
  "description": "Compact capsule control family. `filter` is a selectable toggle chip used for facet selection; `tag` is an informational chip used for metadata badges and dismissable opt-outs. The two share the capsule footprint but diverge on radius, tone, and intent.",
  "useCases": [
    "facet selection",
    "filter toggle",
    "tag",
    "metadata pill",
    "dismissable opt-out"
  ],
  "visualReuse": "open",
  "spec": "chip.md",
  "subcomponents": [
    {
      "slug": "filter",
      "spec": "filter.spec.json",
      "md": "filter.md",
      "default": true
    },
    {
      "slug": "tag",
      "spec": "tag.spec.json",
      "md": "tag.md"
    }
  ]
}
