{
  "$schema": "../../family.schema.json",
  "family": "channel-rail",
  "name": "ChannelRail",
  "description": "Compact horizontal rail of channel avatars — a one-thumb-tap navigator across a user's joined channels. Single-spec family.",
  "useCases": [
    "joined channels nav",
    "compact horizontal channel switcher",
    "one-thumb channel nav"
  ],
  "visualReuse": "open",
  "spec": "channel-rail.md",
  "subcomponents": [
    {
      "slug": "channel-rail",
      "spec": "channel-rail.spec.json",
      "md": "channel-rail.md",
      "default": true
    }
  ]
}
