{
  "$schema": "../../family.schema.json",
  "family": "form-field",
  "name": "FormField",
  "description": "Text-entry family. `input` is the default labeled single-line text field with optional helper / count; `textarea` is the multi-line cousin with a `rows` floor and vertical-only resize; `search` is a bare pill-shaped variant with a leading search glyph; `select` is the Input-shaped picker that opens a sheet.",
  "useCases": [
    "single-line text input",
    "multi-line text input (bio, comment, compose body)",
    "labeled text field",
    "search input",
    "bare search pill",
    "sheet-driven option picker",
    "labelled select+input pairing (e.g. country code + number)"
  ],
  "visualReuse": "locked",
  "layoutInset": "inline",
  "spec": "form-field.md",
  "subcomponents": [
    {
      "slug": "input",
      "spec": "input.spec.json",
      "md": "input.md",
      "default": true
    },
    {
      "slug": "textarea",
      "spec": "textarea.spec.json",
      "md": "textarea.md"
    },
    {
      "slug": "search",
      "spec": "search.spec.json",
      "md": "search.md"
    },
    {
      "slug": "select",
      "spec": "select.spec.json",
      "md": "select.md"
    }
  ]
}
